Name,Destination,Duration,Price,Link,Itinerary
Roomy Walnut Heights Swat Tour,Swat,4 Days 3 Nights,"Rs. 170,000",https://pakistantourntravel.com/tours/roomy-walnut-heights-kalam-trip/,"Luxury tour staying at Walnut Heights with visits to Kalam Valley, Bahrain town and comprehensive Swat sightseeing."
Luxury Maria Resort Kalam Swat Trip,Swat,4 Days 3 Nights,"Rs. 130,000",https://pakistantourntravel.com/maria-resort-kalam-4days-3nights-tour/,"Premium tour with stay at Maria Resort Kalam, covering Swat Motorway journey and Kalam Valley attractions."
Mahodand Lake & Kalam Swat Tour,Swat,5 Days 4 Nights,"Rs. 185,000",https://pakistantourntravel.com/5days-swat-kalam-deluxe-tour/,"Adventure tour covering Mahodand Lake, Kalam Valley, Madayan Bahrain and Ushu Forest with jeep safaris."
5 Days Swat Tour Package,Swat,5 Days 4 Nights,"Rs. 115,000",https://pakistantourntravel.com/5days-swat-tour-package/,"Comprehensive Swat tour covering Fizzaghat, Madayan Bahrain, Malam Jabba and main valley attractions."
3 Days Tour to Swat,Swat,3 Days 2 Nights,"Rs. 65,000",https://pakistantourntravel.com/tours/swat-3days-tour/,"Weekend tour to Swat covering Kalam Valley and Malam Jabba with essential sightseeing and comfortable stays."